{
  "projectSlug": "example-project",
  "securityPlanFile": "security/plan.md",
  "currentPhase": 1,
  "entryMode": "capture",
  "disclaimerShownAt": null,
  "phaseGates": {
    "phase1": { "gate": "hard", "confirmedAt": null },
    "phase2": { "gate": "summary-and-advance" },
    "phase3": { "gate": "summary-and-advance" },
    "phase4": { "gate": "hard", "confirmedAt": null },
    "phase5": { "gate": "summary-and-advance" },
    "phase6": { "gate": "hard", "confirmedAt": null }
  },
  "bucketsCompleted": [],
  "standardsMapped": [],
  "riskSurfaceStarted": false,
  "handoffGenerated": { "ado": false, "github": false },
  "context": {
    "techStack": ["dotnet"],
    "deploymentModel": "cloud-native",
    "dataClassification": "internal",
    "complianceTargets": []
  },
  "referencesProcessed": [],
  "nextActions": [],
  "userPreferences": { "autonomyTier": "guided" },
  "raiEnabled": false,
  "raiScope": "none",
  "raiTier": "none",
  "raiPlannerDispatched": false,
  "aiComponents": []
}
