{
  "projectSlug": "example-project",
  "securityPlanFile": ".copilot-tracking/security-plans/example-project/security-plan.md",
  "currentPhase": 1,
  "entryMode": "capture",
  "disclaimerShownAt": "2026-05-09T14:32:00Z",
  "phaseGates": {
    "phase1": { "gate": "hard", "confirmedAt": null },
    "phase2": { "gate": "summary-and-advance" },
    "phase3": { "gate": "summary-and-advance" },
    "phase4": { "gate": "hard", "confirmedAt": null },
    "phase5": { "gate": "summary-and-advance" },
    "phase6": { "gate": "hard", "confirmedAt": null }
  },
  "bucketsCompleted": [],
  "standardsMapped": [],
  "riskSurfaceStarted": false,
  "handoffGenerated": { "ado": false, "github": false },
  "context": {
    "techStack": [],
    "deploymentModel": "",
    "dataClassification": "",
    "complianceTargets": []
  },
  "referencesProcessed": [],
  "nextActions": ["Complete scoping interview"],
  "userPreferences": { "autonomyTier": "partial" },
  "raiEnabled": false,
  "raiScope": "none",
  "raiTier": "none",
  "raiPlannerDispatched": false,
  "aiComponents": []
}
